,stt_time,stt_word
144,49:26,"들어오세요. 다시 네. 지금 말씀드린 순간 선착순 사은품이 이제 품절이 이제 쭉쭉 될 것 같아요. 
순수 다우니퍼 블랭킷에 걸려 있던 사호품은 끝났습니다. 
모달은 저희가 좀 더 많이 넣어놨기 때문에 모달이 조금 남아 있고 순수에는 다 끝났고 차원 이블도 곧 끝난다고 합니다. 
그래서 선착순 사은품 400분 가져가실 분들은 빠르게 가져가시면 좋을 것 같아요. 
네."
145,49:53,"오늘 마이크가 없어갖고 제가 목이 지금 목이 너무 아프지 목이 아파요 이제 지금 50분이 됐으니까 커피 쿠폰 한번 다 한번 싸드리고 그다음에 여러분 저희가 구매 인증 구매하신 금액을 100% 캐시백을 지금 저희가 추첨을 하고 있어요. 
여기서 그래서 한 5분 뒤에 마감해서 추천할 거니까 여러분들이 빠르게 구매 인증 안 하신 분들 저 구매했어요. 
뭐 샀어요. 이렇게 올려주시면 구매"
146,50:21,"주문번호를 함께 남겨주시면 한 분께 저희가 100% 다시 적립금으로 돌려드리도록 하겠습니다. 
스커프 빅 다시 보여달라고 커피 쿠폰 보여드린 다음에 보여드릴게요. 
캡처 캡처 캡처 캡처 지금부터 아무 말이나 남겨주세요. 
네 아무 말이나 남겨주시면 제가 한 분을 캡처하는데 이번에는 밑에서부터 세 번째 세 번째를 보여드리도록 하겠습니다."
147,50:50,자요 자요
148,50:52,"도메인증도 올려주시고 잘못해서 사은품 선택 못하셨네 내 사원품 선택해 주셔야지 나가 지금 아직 사업품이 순수 빼고는 아직 남아 있으니까 취소하고 다시 주문하세요. 
취소하고 다시 주문하시면 될 것 같고 저요 저요 지금 올려주시면 한 캡처해가지고 밑에서부터 세 번째 있는 분한테 드리도록 하겠습니다. 
하나"
149,51:19,"둘 두구 두구두구두구 두구두구두구 밑에서부터 세 번째입니다. 
어느 구 셋 캡처 네 안 보고 합니다. 
저는 네 갑니다. 열릴 죽 님 아까 댓글 남겨주셨던 분인데 너무 활발하게 소통해 주셨는데 열일 중 님 빨간색으로"
150,51:45,"아 돼 축하드려요. 열릴 정도 여기요 여기 열일 중 님 보이시죠 밑에서 세 번째 분 네 네 열일중 님 축하드립니다. 
네 열일 중 님은 네이버 저희 톡톡으로 주시면 저희가 커피 쿠폰을 바로 드리도록 하겠습니다. 
금액은 라반 가격 언제까지인가요"
151,52:09,"까지 3일 동안 사은품은 선착선 산착수 산착수는 지금 순수는 끝났다고 하고요. 
모달은 남아있고요. 모달을 저희가 제일 많이 넣어놨어요. 
그리고 차원 이불도 아직 좀 남아있다고 하고요 순착수 사업품은 아까 보여드렸는데 요 좋을 것 스카프빕인데 우리 애기들 간절기 되면은"
152,52:32,이렇게 해가지고 이렇게 묶어줘야 되는 거 아시죠 그래서 저희 요거 이중 거즈 저희 블랭킷 만드는 그 이중 거즈로 해가지고 스카 포이 만들어 가지고 요렇게 또 여기에 또 비비엔다 라벨 다 저희가 달려놨기 때문에 이것도 우리 아기가 어린이집 가는데 남의 집 애기들은 다
153,52:51,그냥 가지 손수건 집에서 쓰던 걸로 이렇게 해주는데 우리 아기만 딱 이렇게 해주면 또 여기 이제 우리 비비엔다라고 딱 이렇게 여기 줌 좀 해줘 여기 라벨 이런 거 하나씩 해주면 조금 더 신경 쓰는 조금 더 신경 쓴 엄마로 보일 수 있으니까 이불 사면 요 스커프 믹 저희가 산착순으로 드릴 테니까 요거 요렇게 딱 싸주세요.
154,53:14,"예 한번 내가 이거 인증할까 봐 왜냐면 우리 집 제가 어제 키즈 노트를 돌려보면서 우리 구름이 키즈 노트를 돌려보는데 모든 사진에 이 스카프빕이 색깔별로 있는 거예요. 
왜냐면은"
155,53:29,"가을 되면서 환절기 되면서 되면서는 그냥 어떤 옷을 입든 이걸 하나씩 다 둘러줬거든요. 
저는 그래서 다행히 요거 덕분인지 모르겠지만 감기 유행하고 그럴 때 저희 딸은 아직까지 감기 안 걸렸어요. 
자랑할게요 네 그래서 우리 애기가 안 아픈 게 최고니까 네 취소하고 다시 구매했어요. 
네 감사합니다. 저희 구매 인증 이벤트를 55분에 마감한다고 해요. 
그래서 여러분들 아직 안 남겨주셨으면 빨리 남겨"
156,54:00,"주시면 한 분 추첨해서 구매하신 금액의 100%를 돌려드리도록 하겠습니다. 
주문번호와 함께 남겨주셔요 네. 엔지 미오 님 네 매일 맞아요. 
매일 피로해요. 비비엔다 안 예쁜 게 모양 감사합니다. 
여러분 그다음에 아까 이제 우리 사중 거즈 블랙 킷은 안 보여드렸어요."
157,54:22,"사준 거즈 블링 킷을 톡톡한 느낌을 한번 좀 보여주시면 좋을 것 같고요. 
일단은 남은 시간 동안 사준 거즈 블랭키까지 좀 보여드리도록 하겠습니다."
158,54:37,"사은품 어떻게 하나요. 사은품은 구매하실 때 추가 상품의 보면 있습니다. 
그래서 그거 보고 구매를 하시면 좋을 것 같고요"
159,54:46,네
160,54:47,"저희가 더포도 특가에 지금 준비해 놓은 것 중에 단연 이제 겨울이고 하니까 다우니퍼 블랭킷이나 찰 언니 불이 메인이지만 만약에 신생아 이거나 그다음에 우리 애기가 아직 어려서 출산 준비하거나 아니면 아직 애기가 어리신 분들은 버즈 블랭킷 요런 거 많이 선택하실 거거든요. 
그래서 오늘 이중 거즈 블랭킷도 저희가 오늘 핫딜 상품으로 준비를 해놨으니까"
161,55:11,"저는 출산 준비예요. 그러면 굳이 다운 니퍼나 극세사 같은 거 가지 마시고 이중 거즈 블랭킷은 필수입니다. 
네 필수로 요렇게 준비하시면 좋고 요거는 이제 이중 거즈로 해가지고 거즈 면인데 이중 거즈예요. 
근데 저희가 피그먼트 자연 염색해놔가지고 일반 시중에서 보셨던 뻣뻣한 그런 거지 블링 킷 아니고 부들부들하면서 이렇게"
162,55:36,"한 번 고으면서 삶고 물에서 한 번 쌀만 했기 때문에 이렇게 원단이 올록볼록볼록한 거거든요. 
그래서 요런 이중 거즈 블랭킷도 준비를 해놨으니까 만약에 나는 신생아 출산 준비해 그러면 오늘 요거 특급 때 구매하시는 거 좋죠. 
상추 저는 친구들 출산 선물 하면은 이거는 무조건 껴서 줘요. 
다른 거 줄 때 요거 하나씩 다 껴서 줘요. 
그러면 애들이"
163,56:02,"나중에 이거를 제일 잘 썼다고 말을 하더라고요 맞아요. 
근데 이제 이중 거즈가 좀 얇다 하시면 사중 거즈 블렌 킷이 있습니다. 
사중 거즈 블렌킷은 이중 거즈가 이중 거즈가 어쨌든 너무 얇고 그다음에 이중 거즈에다 저희가 자수를 놓으면 요 앞면에다가 자수를 하면"
164,56:24,"뒷면에다가 그 뒷면에 자수가 그대로 나온단 말이에요. 
저희는 그게 이제 애들한테 거스릴 수 있고 좀 마감이 덜 된 것 같이 좀 아쉬워서 이중 거즈 앞면에다가는 자수를 놔가지고 이렇게 하고 한 면을 더 이중 거주를 해서 총 4중 거주로 만들고 뒷면에는 자수를 안 보이게 이렇게 딱 했어요."
165,56:44,요런 게 사실은 여러분 인터넷에서 사진을 보고 살 때는 이쁜 거 보고 사요 근데 바다 보면 뒷면에 막 자수 다 튀어나와 있어 예 요런 게 사실은 이불 맞지 비비엔다에 샀을 때 퀄리티를 느껴보실 수 있는 차이라고 봐주시면 될 것 같고 데이지도 이렇게 자수 예쁘게 놔져 있고 우리가 디자인별로 보여드리면 하트 공은 요렇게 자수 면이 있고 뒷면은 베이지로 이렇게 배색을 해놨습니다.
166,57:16,"파이닌 비비엔다 퀄리티 만세 배색 네. 
요렇게 배색이 돼 있고요. 그다음에 모닝 브레드는 안면은 이렇게 자수 되어 있고 뒷면은 와이보리로 배색이 돼 있습니다. 
그래서 깔끔한 느낌이라고 봐주시면 될 것 같아요. 
네 그다음에"
167,57:38,"아콤 라마 우리 라마 디자인 또 좋아하시는 분들이 많은데 라마는 라마 자수 부분에 디자인 하나씩 보여드릴게요 요렇게 뒷면에 걷으면 찐돈이 와 퀄리티 좋아요. 
그동안 샀던 이불들의 단점이 하나도 없어요. 
감사해요. 이불을 30년 동안 만들면 저희처럼 돼요."
168,57:58,"저희 사장님 이불을 30년 동안 만드셨는데 이불을 30년 동안 만들면 저희처럼 됩니다. 
네. 레몬도 레몬 너무 상큼하죠. 네 레몬 이런 느낌이라고 봐주시면 될 것 같고 아까 마지막으로 데이지는 살짝 보여드렸는데 데이지는 요런 자수 느낌의 뒷면 또 아이보리로 이렇게 되어 있습니다. 
오늘 만 분이나 들어오시는 이런"
169,58:19,"이렇게 많이 들어와주셔가지고 너무 감사드리고 구매 인증 발표가 끝났다고 하니까 제가 가져오도록 하겠습니다. 
두구두구두구두구두구두구 구구 구매 인증은 제가 한 거 아니고 우리 스텝들이 앞에서 랜덤 추첨기로 돌려요. 
여러분 그래서 내 마음대로 할 수 없다는 거 드셨을 때 나 근데 이거 댓글 본 것 같아 누구"
170,58:52,"금액의 전액을 다시 적립금으로 넣어드리도록 하겠습니다. 
축하 설레는 듯 슬퍼요 감사합니다. 네 구매 인증 이벤트 저희가 매번 방송 때마다 하고 있으니까요. 
한번 럭키한 찬스 노려보시고요. 오늘 여러분 너무 감사합니다. 
오늘 너무 감사드리고 오늘 1만 분 딱 찍고 방송을 마무리할 수 있을 것 같아요. 
오늘 더 퍼즈 특단은 오늘부터 저희가 주말까지"
171,59:17,3데이즈 특가로 준비를 해놨기 때문에 선착순 상품은 지금 거의 다 소진이 되었고 그다음에 주말까지 해가지고 열어둘 거니까 아직도 고민 중이신 분들은 라이브 한번 보신 거를 토대로 조금 비교해보셔가지고 우리 애는 그래도 이런
172,59:34,"부드러운 거 너무 좋아해 이런 촉감에 너무 좋아해 하면 다운 니퍼 블랭킷 가시면 될 것 같고 나는 안 그래도 차르 잎을 하나 사려고 했는데 하시면 차르 잎을 사시면 될 것 같고 극세사 블랭키부터 얇은 블랭키까지 원하시는 대로 구매하시면 좋을 것 같아요. 
네. 네 그러면 오늘 오늘도 방송 많이 라이브 낮잠 이불 세트 라이브 해 주세요. 
파인이 한번 준비해 보도록 하겠습니다."
173,1:00:00,"네 오늘 많이 시청해 주셔서 감사드리고요 저희는 다음 주 화요일 까라소 특가로 다시 오도록 하겠습니다. 
감사합니다."
